{
  "id": "falling_rocks",
  "schemaVersion": 1,
  "categoryId": "road_signs",
  "subCategoryId": "warning",
  "difficulty": 4,
  "weight": 1,
  "regions": [
    "*"
  ],
  "enabled": true,
  "name": {
    "en": "Falling rocks",
    "nb": "Steinras"
  },
  "description": {
    "en": "A warning triangle with rocks tumbling down a slope.",
    "nb": "Faretrekant med stein som raser ned en skråning."
  },
  "image": {
    "aspect": "1:1",
    "format": "webp",
    "px": 512
  },
  "license": {
    "source": "placeholder",
    "type": "CC0-1.0",
    "author": "generated",
    "attributionRequired": false,
    "acquiredAt": "2026-08-06"
  }
}
