{
  "id": "rainbow",
  "schemaVersion": 1,
  "categoryId": "nature",
  "subCategoryId": "sky",
  "difficulty": 5,
  "weight": 1,
  "regions": [
    "*"
  ],
  "enabled": true,
  "name": {
    "en": "Rainbow",
    "nb": "Regnbue"
  },
  "description": {
    "en": "A colorful arc across the sky.",
    "nb": "En fargerik bue over himmelen."
  },
  "image": {
    "aspect": "1:1",
    "format": "webp",
    "px": 512
  },
  "license": {
    "source": "placeholder",
    "type": "CC0-1.0",
    "author": "generated",
    "attributionRequired": false,
    "acquiredAt": "2026-08-06"
  }
}
