{
  "id": "bridge",
  "schemaVersion": 1,
  "categoryId": "buildings",
  "subCategoryId": "infrastructure",
  "difficulty": 3,
  "weight": 1,
  "regions": [
    "*"
  ],
  "enabled": true,
  "name": {
    "en": "Bridge",
    "nb": "Bru"
  },
  "description": {
    "en": "A bridge spanning water.",
    "nb": "En bru over vann."
  },
  "image": {
    "aspect": "1:1",
    "format": "webp",
    "px": 512
  },
  "license": {
    "source": "placeholder",
    "type": "CC0-1.0",
    "author": "generated",
    "attributionRequired": false,
    "acquiredAt": "2026-08-06"
  }
}
