{
  "id": "horse",
  "schemaVersion": 1,
  "categoryId": "animals",
  "subCategoryId": "livestock",
  "difficulty": 3,
  "weight": 1,
  "regions": [
    "*"
  ],
  "enabled": true,
  "name": {
    "en": "Horse",
    "nb": "Hest"
  },
  "description": {
    "en": "A standing horse.",
    "nb": "En hest som står."
  },
  "image": {
    "aspect": "1:1",
    "format": "webp",
    "px": 512
  },
  "license": {
    "source": "placeholder",
    "type": "CC0-1.0",
    "author": "generated",
    "attributionRequired": false,
    "acquiredAt": "2026-08-06"
  }
}
