{
  "id": "church",
  "schemaVersion": 1,
  "categoryId": "buildings",
  "subCategoryId": "civic",
  "difficulty": 3,
  "weight": 1,
  "regions": [
    "*"
  ],
  "enabled": true,
  "name": {
    "en": "Church",
    "nb": "Kirke"
  },
  "description": {
    "en": "A white church with a steeple.",
    "nb": "En hvit kirke med spir."
  },
  "image": {
    "aspect": "1:1",
    "format": "webp",
    "px": 512
  },
  "license": {
    "source": "placeholder",
    "type": "CC0-1.0",
    "author": "generated",
    "attributionRequired": false,
    "acquiredAt": "2026-08-06"
  }
}
