{
  "id": "red_barn",
  "schemaVersion": 1,
  "categoryId": "buildings",
  "subCategoryId": "rural_structures",
  "difficulty": 1,
  "weight": 2,
  "regions": [
    "*"
  ],
  "enabled": true,
  "name": {
    "en": "Red barn",
    "nb": "Rød låve"
  },
  "description": {
    "en": "A classic red-painted barn.",
    "nb": "En klassisk rødmalt låve."
  },
  "image": {
    "aspect": "1:1",
    "format": "webp",
    "px": 512
  },
  "license": {
    "source": "placeholder",
    "type": "CC0-1.0",
    "author": "generated",
    "attributionRequired": false,
    "acquiredAt": "2026-08-06"
  }
}
