{
  "id": "stop_sign",
  "schemaVersion": 1,
  "categoryId": "road_signs",
  "subCategoryId": "prohibition",
  "difficulty": 1,
  "weight": 2,
  "regions": [
    "*"
  ],
  "enabled": true,
  "name": {
    "en": "Stop sign",
    "nb": "Stoppskilt"
  },
  "description": {
    "en": "A red octagon that says STOP.",
    "nb": "Rød åttekant der det står STOPP."
  },
  "image": {
    "aspect": "1:1",
    "format": "webp",
    "px": 512
  },
  "license": {
    "source": "placeholder",
    "type": "CC0-1.0",
    "author": "generated",
    "attributionRequired": false,
    "acquiredAt": "2026-08-06"
  }
}
