{
  "id": "roundabout",
  "schemaVersion": 1,
  "categoryId": "road_signs",
  "subCategoryId": "mandatory",
  "difficulty": 3,
  "weight": 1,
  "regions": [
    "*"
  ],
  "enabled": true,
  "name": {
    "en": "Roundabout",
    "nb": "Rundkjøring"
  },
  "description": {
    "en": "Three blue arrows chasing each other in a circle.",
    "nb": "Tre blå piler som følger hverandre i en sirkel."
  },
  "image": {
    "aspect": "1:1",
    "format": "webp",
    "px": 512
  },
  "license": {
    "source": "placeholder",
    "type": "CC0-1.0",
    "author": "generated",
    "attributionRequired": false,
    "acquiredAt": "2026-08-06"
  }
}
