{
  "id": "forest",
  "schemaVersion": 1,
  "categoryId": "nature",
  "subCategoryId": "terrain",
  "difficulty": 3,
  "weight": 1,
  "regions": [
    "*"
  ],
  "enabled": true,
  "name": {
    "en": "Forest",
    "nb": "Skog"
  },
  "description": {
    "en": "A stand of evergreen trees.",
    "nb": "En samling grantrær."
  },
  "image": {
    "aspect": "1:1",
    "format": "webp",
    "px": 512
  },
  "license": {
    "source": "placeholder",
    "type": "CC0-1.0",
    "author": "generated",
    "attributionRequired": false,
    "acquiredAt": "2026-08-06"
  }
}
