{
  "id": "deer",
  "schemaVersion": 1,
  "categoryId": "animals",
  "subCategoryId": "wild",
  "difficulty": 4,
  "weight": 1,
  "regions": [
    "*"
  ],
  "enabled": true,
  "name": {
    "en": "Deer",
    "nb": "Rådyr"
  },
  "description": {
    "en": "A roe deer at the roadside.",
    "nb": "Et rådyr ved veikanten."
  },
  "image": {
    "aspect": "1:1",
    "format": "webp",
    "px": 512
  },
  "license": {
    "source": "placeholder",
    "type": "CC0-1.0",
    "author": "generated",
    "attributionRequired": false,
    "acquiredAt": "2026-08-06"
  }
}
