{
  "id": "waterfall",
  "schemaVersion": 1,
  "categoryId": "nature",
  "subCategoryId": "water",
  "difficulty": 4,
  "weight": 1,
  "regions": [
    "*"
  ],
  "enabled": true,
  "name": {
    "en": "Waterfall",
    "nb": "Foss"
  },
  "description": {
    "en": "Water cascading down a cliff.",
    "nb": "Vann som fosser ned et stup."
  },
  "image": {
    "aspect": "1:1",
    "format": "webp",
    "px": 512
  },
  "license": {
    "source": "placeholder",
    "type": "CC0-1.0",
    "author": "generated",
    "attributionRequired": false,
    "acquiredAt": "2026-08-06"
  }
}
