{
  "id": "tunnel_sign",
  "schemaVersion": 1,
  "categoryId": "road_signs",
  "subCategoryId": "info",
  "difficulty": 3,
  "weight": 1,
  "regions": [
    "*"
  ],
  "enabled": true,
  "name": {
    "en": "Tunnel",
    "nb": "Tunnel"
  },
  "description": {
    "en": "A road disappearing into a tunnel arch.",
    "nb": "En vei som forsvinner inn i en tunnelåpning."
  },
  "image": {
    "aspect": "1:1",
    "format": "webp",
    "px": 512
  },
  "license": {
    "source": "placeholder",
    "type": "CC0-1.0",
    "author": "generated",
    "attributionRequired": false,
    "acquiredAt": "2026-08-06"
  }
}
