{
  "id": "lorry",
  "schemaVersion": 1,
  "categoryId": "vehicles",
  "subCategoryId": "truck",
  "difficulty": 1,
  "weight": 2,
  "regions": [
    "*"
  ],
  "enabled": true,
  "name": {
    "en": "Lorry",
    "nb": "Lastebil"
  },
  "description": {
    "en": "A large truck hauling cargo.",
    "nb": "En stor lastebil med last."
  },
  "image": {
    "aspect": "1:1",
    "format": "webp",
    "px": 512
  },
  "license": {
    "source": "placeholder",
    "type": "CC0-1.0",
    "author": "generated",
    "attributionRequired": false,
    "acquiredAt": "2026-08-06"
  }
}
