{
  "id": "children_crossing",
  "schemaVersion": 1,
  "categoryId": "road_signs",
  "subCategoryId": "warning",
  "difficulty": 3,
  "weight": 1,
  "regions": [
    "*"
  ],
  "enabled": true,
  "name": {
    "en": "Children",
    "nb": "Barn"
  },
  "description": {
    "en": "A warning triangle with two children walking.",
    "nb": "Faretrekant med to barn som går."
  },
  "image": {
    "aspect": "1:1",
    "format": "webp",
    "px": 512
  },
  "license": {
    "source": "placeholder",
    "type": "CC0-1.0",
    "author": "generated",
    "attributionRequired": false,
    "acquiredAt": "2026-08-06"
  }
}
