{
  "id": "motorhome",
  "schemaVersion": 1,
  "categoryId": "vehicles",
  "subCategoryId": "recreational",
  "difficulty": 3,
  "weight": 1,
  "regions": [
    "*"
  ],
  "enabled": true,
  "name": {
    "en": "Motorhome",
    "nb": "Bobil"
  },
  "description": {
    "en": "A boxy camper van / motorhome.",
    "nb": "En firkantet bobil."
  },
  "image": {
    "aspect": "1:1",
    "format": "webp",
    "px": 512
  },
  "license": {
    "source": "placeholder",
    "type": "CC0-1.0",
    "author": "generated",
    "attributionRequired": false,
    "acquiredAt": "2026-08-06"
  }
}
